,reviews,stars,Compound Score,Sentiment,word_count
621,"It, never worked as advertise, won't turn TV on or off , volume never work this my 2nd remote, just plain garbage.",1,0.0,Neutral,22
622,My old remote died because I got water on it. This is an identical replacement and works perfectly. It’s extremely responsive. I love it.,5,0.8341,Positive,24
623,I destroyed the one that came with my stick so this was purchased to replace it. Took about 10 minutes to figure it out and it works perfectly.,5,0.25,Positive,28
624,I lost my original firestick remote while I was moving so this does the job. The volume buttons don’t change anything and the power button doesn’t turn it on or off soooo I’m not sure what it’s for. Still recommend,4,0.1376,Positive,40
625,"This is my second one. The first one worked great for 2 plus year until a drink was accidentally dropped in a drink. The new one never worked - countless hours spent trying to figure it out.

It’s too late for me to return. Just want to prevent others from making the same mistake.",1,0.1779,Positive,54
626,"Easy to program. It replaced my old ""refurbished"" remote that failed looks like due to water damage?",5,-0.2732,Negative,17
627,"Such a nice addition to have the volume control on the remote. Relieves me of having multiple remotes, with one for the volume, etc.",5,0.6486,Positive,24
628,I don't have Alexa and have no plans to obtain one. This is a replacement remote. Works fine.,4,-0.1027,Negative,18
629,Works perfectly with my Amazon fire stick. I’ve had zero problems with it. Very reliable!,5,0.2714,Positive,15
630,Needed a replacement remote since my last one died due to dog drool. It was easy to sync.,5,-0.1779,Negative,18
631,I returned this item bc it was ordered by mistake. I have a few in the home already & we love it!,5,0.4753,Positive,22
632,"Im very upset I was very happy and excited to receive this but when I got it the control Alexa did not work, they sent a second one but that also did not work, it is the only (but most important feature) It was the reason I bought this over a chromecast and Im very upset. Spent one hour over the phone with Amazon to see what was the issue and they could not figure it out, Im very upset.",1,-0.3834,Negative,80
633,Worked right out of the box. I was so amazed I didn’t have to link it to the fire stick.,5,0.4051,Positive,20
634,"this is a great upgrade, i have two, one was defective Amazon sent me a replacement overnight!",5,0.4926,Positive,17
635,"It’s always good to have a second remote, especially when my son is always losing track of it.",5,0.0772,Positive,18
636,Bought this for my tv without any home theater add-ons. It makes everything so much easier with just having one remote as opposed to 2.,5,0.4728,Positive,25
637,Our dog actually ate the remote for out Fire Cube so this was a replacement. It works great!! Thanks!!!,5,0.7762,Positive,19
638,There are no complaints since it works and it works consistently! Great price on sale.,5,0.7684,Positive,15
639,Love these new remotes that control volume. It's awesome not to have to use two remotes,5,0.8519,Positive,16
640,I cannot connect to tv unless I have original remote device. Defeating the reason why I bought it.,2,-0.0772,Negative,18
641,Pairs extremely easily with your Firestick and the convenience of having the power button and volume control makes it totally worth it.,5,0.5975,Positive,22
642,I ordered 4 fire sticks 3 of them have been great the 4th one has had to be replaced twice can't explain no warning just freezes up won't move anything. The other 3 no problem.,3,0.4751,Positive,35
643,"So easy to set up! And only one set of batteries to control TV power, volume, and the fire stick, unlike other solutions or having multiple remotes.",5,0.4186,Positive,27
644,"When my little misplaced my initial fire tv stick remote, this replacement was exceptionally easy to pair as a replacement. It synced up seamlessly to my tv as well to control the volume and turning on and off (features our original fire remote did not have!) extremely happy with the purchase!",5,-0.2514,Negative,51
645,Didnt get to use it my dog ate it before I could try so it didnt live long enough out of the package,3,0.0,Neutral,23
646,Great product for one time use. The TV part stopped working. I kept it because I still need a remote for my Firestick. I didn't bother to try and reprogram it.,3,0.6412,Positive,31
647,Love the new remote. Love that it can also turn my TV on and off and adjust the volume. Great Additions.,5,0.926,Positive,21
648,Works perfectly. Don't lose your remote because this one is VERY expensive. Good grief at $29.99,5,0.7359,Positive,16
649,"Works great. Bundles YoutubeTv, Netflix, Amazon Prime Video, and Amazon Music. The smart tv ( 5 yr old Samsung tv) did not have YoutubeTv as an app since I cut the cable tv. Netflix and Amazon Prime Video load and play much faster thru the Firestick than thru the tv. Easy and fast access to Amazon music so I use it more often.",5,0.93,Positive,63
650,Could not hook up to any device. Must have misund÷rstood how it worked when bought it,3,0.0,Neutral,16
651,So this was actually a replacement. A bit pricey. I would love to see a feature if lost that would cause it to beep until found. I hate to spend $40 on another remote.,5,-0.2023,Negative,34
652,BATTERIES SENT WERE DEAD AND EVEN REPLACING BATTERIES REMOTE WILL NOT CONNECT TO FIRE TV STICK!!!,1,-0.6298,Negative,16
653,"Making the transition from the original remote to the second model was a success. It recognized my flat screen model, power and volume control test have passed and adding my receiver to the lineup, it can't get no better than that. It's the best choice to give the stick a breather from overheating.",5,0.905,Positive,53
654,Used for a Fire Stick it performs all functions properly and is a good solid remote.,5,0.2732,Positive,16
655,Pairs so easily. Of course I found the original as soon as I paired the replacement.,5,0.6115,Positive,16
656,I like everything about this except it is difficult to take it apart to put the batteries in the remote. Otherwise I would give it a five star review.,4,0.0,Neutral,29
657,It appears that you cannot move the fire stick from one tv to another once it is setup on a tv. I called tech support to try to resolve the problem but couldn’t get the remote to control the volume and tv on off functions. The final resolution was that Amazon refunded my money and said to dispose the fire stick.,1,0.069,Positive,61
658,"Getting even cheaper made, some work, some dont. Battery cover comes off too easily, have to tape it on.",1,0.34,Positive,19
659,"My dog likes to chew on remotes, it's kinda his thing. So about twice a year I gotta buy a new remote. Funny thing about this remote is it's very similar priced to a entirely new fire stick TV.

On prime day, this remote was MORE EXPENSIVE then a brand new 4k fire stick.",1,0.1585,Positive,54
660,The volume control and power control make my Fire TV Stick complete now that I don't have to use 2 remotes to enjoy a TV show.,5,0.2023,Positive,26
661,"If you have one of the earlier versions of the Amazon remote, then you will love this new one. Not only is this more versatile but it isn't as annoying with the loud clicks! Thanks Amazon for the welcome improvement.",5,0.9639,Positive,40
662,It works. It is a replacement for the original. I only gave it four stars because the original should have lasted longer.,4,0.5574,Positive,22
663,"This remote controls my Vizio tv, Vizio soundbar, and the firetv. perfect. I can turn on and off all as well as control the volume of my soundbar",5,0.7003,Positive,28
664,Love this remote & thankful it was delivered 1 day early & placed in the mailbox.,5,0.836,Positive,16
665,Can’t get to connect to fire stick. Have followed directions.,1,-0.34,Negative,10
666,"Needed a replacement remote because the original just stopped working. Hope it lasts longer than the original. At this sale price it was worth it, but at the original price might as well buy a new firestick.",4,0.8338,Positive,37
667,We got this when the original remote was lost. I LOVE the added volume and power controls. Now we don’t need two remotes to watch tv. Haven’t used the voice control.,5,0.7125,Positive,31
668,Needed a new remote and this controls power and volume. Just dont use the tv for power to the fire stick.,5,-0.34,Negative,21
669,The original remote stopped working. My order for replacement remote came a day early. It took a few tries to pair. But so far no issues works great.,5,0.5621,Positive,28
670,"Bought this to replace my original. Apparently my dog loves chewing on Alexia.
Works great, very easy to sick up to fire stick",5,0.8089,Positive,23
671,Why oh why oh why did you put the home button in the middle of the navigation buttons??? Next version - MOVE THE HOME BUTTON OUT OF THE WAY!!!,1,0.0,Neutral,29
672,I can not get it to properly pair to the existing Fire.,1,-0.34,Negative,12
673,Must buy for the Nvidia Shield TV as the original never worked properly. Only thing that doesn't work is voice search. Don't mind at all.,5,0.3182,Positive,25
674,From what I understand it’s cheaply made I bought one already not including the one I bought originally. Second started having same issue luckily I can use my TVs remote to use for the fire stick,2,0.2263,Positive,36
675,Very easy to set up : just follow the instructions : Have five fire sticks and six remotes.,5,0.2006,Positive,18
676,I am very happy with the order and how fast it came. Once again thanks and will again from Amazon.,5,0.8221,Positive,20
677,I lost my remote for our Fire cube and was thrilled to get this replacement. Of course I found our remote but having two is not a bad idea,4,0.5228,Positive,29
678,I love this remote it does everything it's advertise to do. I'm going order two more. Vo,5,0.6369,Positive,17
679,Love it should of first came this way..I think that a trade in for your older version should be in the mix...WHAT YA SAY AMAZON?,5,0.7672,Positive,25
680,"This remote does not work at all, it will not sync with my fire tv box no matter how many times I try. No matter how i try, videos I watch or time I spend working on this it will not sync with my fire T.V. Box. I've spent literally hours trying to sync this garbage with no luck. Amazon probably sent me a defective remote from a previous return, re-boxed it and sent it to me.",1,-0.8704,Negative,77
681,I really like the remote but the battery cover doesn’t stay in place.,4,0.2255,Positive,13
682,"Broke in 1 month and amazon isn’t replacing it wtf, I even put name brand batteries in it but it stopped working",1,-0.5267,Negative,22
683,This is my 2nd remote brought in 9/2020 and now it's dead. I've tried everything to get it to work. . Nothing.,1,-0.6486,Negative,22
684,Awful remote! I’m so disappointed that Amazon treats they’re loyal customers this way. I have a fire tv and I’ve bought three replacement remotes already and they all die. We’ve tried everything to fix it. I can’t pay for a new remote every time the battery dies. It’s just not logical.,1,-0.8726,Negative,51
685,"Easy to set up, I was using this within 3 minutes of opening the package. It paired instantly after following the easy instructions.",5,0.7003,Positive,23
686,TO CONTROL ACCESS TO AMAZON PRIME> THE Original REMOTE DOES NOT WORK AT ALL>,1,0.5766,Positive,14
687,Remote is small. Opening the case to replace batteries can be improved. I'm older with dexterity not as it was. Amazon is working on this with their design team. Most impressed by the great customer service from Amazon!,5,0.9229,Positive,38
688,Awesome,5,0.6249,Positive,1
689,We have used this alot lately and enjoy the useful remote for our Firestick!,5,0.75,Positive,14
690,"After i dropped my remote in the disposal this was the replacement. Simple: soak in rice , eventually unpair and re-pair new remote. Fire tv is fine.",5,-0.1531,Negative,27
691,"This will not work with a Toshiba Fire Edition tv. In fact, if you bought a TV with Amazon Fire TV included, DO NOT assume this remote will work. It won't. Go look for the Toshiba/Insignia remote based off of the TV model.",1,-0.4767,Negative,43
692,Great. What did I do before the fire stick and remote? Missed out. Love my system.,5,0.6908,Positive,16
693,"It's nice to have the option to buy an extra remote for Fire TV. If you can't find one, you'll find the other. You will have better control of the TV...lol.",5,0.5106,Positive,31
694,Love being able to pair tv to this remote to control both fire stick and tv 📺,5,0.4215,Positive,17
695,We've only had it a couple of months and it already doesn't work properly.,5,0.0,Neutral,14
696,One remote to turn my TV on and off and the volume up and down and select all you need on the Fire Stick! So simple but so great. Set up was easy and works with my 8 year old Sony LED TV.,5,0.9153,Positive,43
697,"Replaced my old Fire TV remote with this one, that controls the TV power and my sound bar volume. Well worth it.",5,0.1531,Positive,22
698,"It does remote things. I've never had a problem with it, I'm not sure about what all the bad reviews are on about. Don't over think it. Connect remote, let it update, program (which is very easy) and leave it alone.

It's a remote. It does remote things. I quite like it.",5,0.0819,Positive,52
699,"Yep yep, it's a replacement for the one I never found and it works great.",5,0.8176,Positive,15
700,So i lost my remote to my firestick and ordered another one. It was pretty easy to set up and works great! No complaints,5,0.8799,Positive,24
701,I paired this with our 3rd gen fire tv (the one with the square pendant). Was VERY easy to set up. We didn’t have our original remote but were using the app on our iPhone to control the app for a while and it was still very easy to set up using the remote app. I love having one remote to turn the tv on/off and control volume as well as controlling the actual fire tv.,5,0.9194,Positive,76
702,"Some of the buttons, including the Home button, do not respond.",1,0.0,Neutral,11
703,The best thing about this remote is that I can control the volume of my tv with this! Easy to use and cute design!,5,0.9034,Positive,24
704,"This remote has the worst design. I have been trying for over an hour to open it to install the batteries, and I am still unable to get this open. This is not the first remote from Amazon that I have had trouble with. Amazon must redesign this so that anyone can install the batteries.",1,-0.6597,Negative,55
705,"I have replaced this remote twice now and it continues to stop working, even with fresh batteries.",1,0.0258,Neutral,17
706,Love this remote. This is perfect for anyone who uses fire tv for streaming. No need for 2 remotes anymore.,5,0.6486,Positive,20
707,"would recommend. My 2 year old dumped our original remote to our fire stick on some juice which stopped it from working , ordered this and this baby works like a charm ! The only thing I have to complain about is the price , don’t understand why it cost as much as a brand new fire stick set would but still love it",5,0.7678,Positive,64
708,"Everything works like the original remote I had..
And it was simple to reconnect. I just held the home icon button down for 5-10 seconds until it connected. Then we went from there..",5,0.5859,Positive,33
709,Bought this for a replacement remote for my 4k Fire TV after my toddler made mine mysteriously dissapear and it works perfectly and was extremely easy to setup,5,0.7178,Positive,28
710,I think it was a little high priced. But I needed a new one.,4,0.0,Neutral,14
711,"Great replacement that was very easy to set up after our dog decided to have the prior one for dinner. Plus, it makes a great chew toy.",5,0.908,Positive,27
712,"The only flaw in my old Firestick Remote was that I needed my TV remote to turn the TV on and control the sound level. Now, the Fire Remote does it all. Excellent!",5,0.3802,Positive,33
713,"This is the remote is the second one i get. Went to turn on and use today and did not work at all. Called Amazon, did all the troubleshooting and still not working. They would not replace for a new one.",2,0.34,Positive,41
714,Remote works great. Voice control always works. Could not get the volume controls to work with my TV.,5,0.6249,Positive,18
715,NOTHING WORKED the remote or the tv I spent 3 hours and looked at the ratings and etc. and they all said the same thing that I'm experiencing wasting 3 hours and in the end its terrible if u do get it running at all...sent back immediately,1,-0.7003,Negative,47
716,"Dog ate the last one. This was a replacement. Very happy with our remote and it was working really good until it’s untimely demise. Hopefully, we can prevent this one from the same fate!",5,0.8828,Positive,34
717,"Every time I try to use the voice command on this, instead of tuning to the proper program, my connection switches from HDMI 1 to HDMI2. What the heck???",3,0.0,Neutral,29
718,I had the last generation remote and you had to buy a 3rd party attachment to control your tv. This new remote adds the feature to control TVs and soundbars and it works great. Super easy to setup as well.,5,0.9509,Positive,40
719,I didn't think I'd need it but it's great to use one remote the majority of the time. I barely use the cable one anymore,5,0.7684,Positive,25
720,"Must taste good, dog likes to eat it. This is our second one. Read the instructions for setup",5,0.6908,Positive,18
721,No good dont work all the time. Have to keep returning it repeatedly. Freeze almost everyday. Hate it will not buy again,1,-0.6836,Negative,22
722,Remote stopped working after just a few months! It’s a $30 remote the cost of almost an entire unit.. less than six months later and it’s useless,1,-0.6114,Negative,27
723,"I chatted with Amazon to make sure my Firestick was 2nd gen and compatible. After reading some reviews, I was concerned about that.
Husband paired it to the firestick. Said the power and volume weren’t working. Went into Settings-Equipment Control and setup our TV on the remote. Walla. Power and volume working great now.
So nice to only have 1 remote!!",5,0.8951,Positive,61
724,"Great remote, however I would like to have a separate power button for sound. At times Alexa turns on the TV but not the sound.",4,0.5106,Positive,25
725,This is our second one in under 6 months because the original batteries that came in the first one eroded and ruined it.,4,-0.2023,Negative,23
726,"Works great
Easy to sync up to system since puppy chewed up the original one",5,0.8519,Positive,15
727,"I love my Firestick with the Alexa remote. It's all super easy to use, and easy to setup!",5,0.9348,Positive,18
728,"remote was easy to pair with both my fire tv and regular tv, the voice recognition seems flawless.",5,0.5859,Positive,18
729,"End up hitting the home key by mistake most of the time, lol. Better than after markets!",5,0.5562,Positive,17
730,Ordered so I could eliminate having to use two remotes. The ir codes on the remote are not compatible with my popular name brand tv. This remote is no better than my old 1st gen remote. Still have no volume or power control.,1,-0.2037,Negative,43
731,Lost my original remote! Paired up to my FireTVStick 4K in two seconds!!! Perfect and no hassle!,5,0.5673,Positive,17
732,"I only had one problem, the volume, you have to be in front of the tv for it to function. That's it, everything works.",5,-0.4019,Negative,24
733,Makes like a lot easier searching for things with the voice remote,5,0.6486,Positive,12
734,Only lasted 3 months. You have to be very careful or it will stop working.,1,-0.079,Negative,15
735,"I ordered this remote to replace the original which is lost in the sofa forever, and I love it,.......more features than the original including volume control...and soooo easy to program!",5,0.8655,Positive,30
736,"This is our 2nd remote that I bought and the back cover is slipping and batteries are getting exposed
With kids, this is a real problem",1,-0.4588,Negative,26
737,"I've had 2/2 replacement remotes stop out of nowhere. Works amazing IF, and it's a huge if, it works and pairs up correctly. Nothing they have recommended has helped at all, it won't reset and the batteries aren't dead. A $30 headache that you can't return or replace even tough it says it still in the window of replacement.",1,-0.1586,Negative,59
738,"These remotes do not last 3 months - very hard to install batteries
Was switched to 4 or 5 different techs when I called for help. Was on the phone for over 2 hours",1,0.2516,Positive,34
739,Volume control is a great feature. Syncs with my TV and surround sound. Very smooth operation,5,0.6249,Positive,16
740,This is my 5th one for the Fire box. Come on Amaxon either up your quality or charge way less!,2,-0.4003,Negative,20
741,"It allowed me to put away my TV controller. The power button, volume up/down and mute button allows me to control everything from one small device, fire stick version 2",5,-0.34,Negative,30
742,"Good at first, but died on me after a few months. Very frustrating.",2,-0.8496,Negative,13
743,Exactly what I expected. Easy setup to Samsung TV and Fire Stick bought during 2018 Prime Day. Perfect!,5,0.6696,Positive,18
744,Its the original firestick remote. Does everything as it should.,5,0.3182,Positive,10
745,"When it works it's good
I bought this for my Nvidia Sheild. At first it was great. Then after about 2 weeks it wouldn't pair or control my device. I reset it but it does not last. Very disappointed.",2,0.7996,Positive,39
746,The power button and Alexa voice recognition don't work.,1,0.0,Neutral,9
747,Amazon sent me this remote to replace my original remote that had failed. The addition of a volume control is very handy indeed. It works as intended.,5,-0.0772,Negative,27
748,"Kids lost my remote, got it quick and easy to install. Works great.",5,0.6908,Positive,13
749,"Dude, this remote is so bad a$$ that it can not only control my Fire stick, soundbar and TV, it also can control my electric fireplace...even though I didn't want it to...",5,-0.7971,Negative,32
750,"Stoped working the second day of use. I took out batteries and restarted my fire stick multiple times, did not pair or work again.",1,-0.34,Negative,24
751,"Great description, great Price & fast delivery! Thank you!! 💯👍🏻👍🏻⭐️⭐️⭐️⭐️⭐️",5,0.9114,Positive,10
752,"The product, itself is a 5 star item. But the seller a bought it from was selling it for double the price that other sellers are selling it for. (I sent it back)",2,0.0,Neutral,33
753,"WHAT CAN I SAY ABOUT THIS REMOTE? NOTHING, I DO NOT USE IT ANYMORE.",1,0.0,Neutral,14
754,This remote is the best thing since the firestick. It can also control your TV and volume no more having 2 remotes,5,0.4588,Positive,22
755,Like that it lets me control the volume as well as the power button of the TV,5,0.5574,Positive,17
756,Item doesn’t work from time to time & Getting worse. No way to replace and we’ve only had 6 months. No customer service to ask for replacement.,1,-0.7579,Negative,27
757,Everything is great. My dog did chew it up. I will buy another one. Easy to use. Not complicated.,5,0.7906,Positive,19
758,Wish I could but somehow the distribution center 5 minutes from my house doesn't know how to scan or drop my package off. Guess I am done with Amazon happened 3 times in the past month.,1,0.0644,Positive,36
759,"Works great with my TV and soundbar. Only thing was the volume connected to my tv initially, so I had to research to find out how to change it to my soundbar, but it was pretty easy.",5,0.8934,Positive,37
760,Now we both have our own remote so we don't have to pass the one around anymore.,5,0.0,Neutral,17
761,"Alexa has made it much easier to find movies & other programs. As a Senior, I would recommend this Firestick for other Seniors",5,0.6486,Positive,23
762,The remote would not connect to my TV it is the same remote that I lost for my TV I made sure before I purchased it and it cannot be programmed and does not pick up a signal from my TV. I tried all the steps even changing the batteries nothing worked I was able to download the remote on my phone and that is how I was able to use my Tv,1,0.0,Neutral,73
763,Always improving tjis gadgets. Im on my 4th one and love it.,5,0.7906,Positive,12
764,"These remotes go out too much. Ive had to purchase two or three remotes
I dont drop or mishandle my things",1,0.2057,Positive,21
765,Not compatible; need 2st generation: would like to exchange. Is that doable?,3,0.3612,Positive,12
766,I got this remote to work with my Nvidia Shield tv. This remote works great! Pairing the two together was a breeze and I am glad it takes AAA batteries rather than the pesky watch style batteries.,5,0.7345,Positive,37
767,I really mainly use it to get the weather. It's great to know what the temperature is.,5,0.6249,Positive,17
768,Wish someone had thought to put Volume and Power buttons on the first version. Would have saved me some $$$$.,5,0.6705,Positive,20
769,This was a replacement for my Firestick remote that was no longer working (Alexa wasn't responding).,5,-0.296,Negative,16
770,Does not work at all and this is my second one in two weeks,1,0.0,Neutral,14
771,This remote works great! The directions were straight forward and the remote paired easily to my older Sylvania tv. The only issue I had was with removing the back cover to put in the batteries but overall this wasn't a big deal.,5,0.6114,Positive,42
772,Too many problems with voice recognition and with the firestick losing internet connection,2,-0.6486,Negative,13
773,The volume and power buttons are a huge plus compared to the original remote. I do with there was an input button though,5,0.5574,Positive,23
