,reviews,stars,Compound Score,Sentiment,word_count
1998,The original remote did not last a year. I hope to get better service with the new one.,5,0.7964,Positive,18
1999,It's a great remote. So great in fact I'm on my 3rd one because my dog finds it tasty!,5,0.8685,Positive,19
2000,didn't work right from the time we opened it.. should have returned but husband threw everything away,1,0.0,Neutral,17
2001,Love this remote! It’s easy to use and the volume controls make it so it’s the only controller you need.,5,0.8122,Positive,20
2002,"was able to add to my Fire TV cube, easy to pair",5,0.128,Positive,12
2003,Love that you control volume with this,5,0.6369,Positive,7
2004,Working good I am very satisfied,4,0.7178,Positive,6
2005,Great! Just the solution needed with the TV volume buttons.,5,0.7712,Positive,10
2006,Have to pair the remote each time I turn TV on,3,0.0,Neutral,11
2007,It work like they said it would like that very good product,5,0.8016,Positive,12
2008,No es loke pedy,1,-0.296,Negative,4
2009,Awsome,5,0.0,Neutral,1
2010,This remote has never worked. I am still not able to pair it to my tv. Very upsetting.,1,-0.5256,Negative,18
2011,my remote will not sync to my firestick I purchased the remote because the other remote was lost I was using the app but remote but neither will work for my firestick ever since I moved,1,-0.1655,Negative,36
2012,Item is just what I expected. I’m satisfied,5,0.4215,Positive,8
2013,"This stick died, no output, after 1yr and 5days, priceless",5,-0.7003,Negative,10
2014,Control everything with 1 remote,5,0.0,Neutral,5
2015,Works like a charm,5,0.6369,Positive,4
2016,Works really well,5,0.3384,Positive,3
2017,I love this service,5,0.6369,Positive,4
2018,perfect replacement,5,0.5719,Positive,2
2019,Awesome,5,0.6249,Positive,1
2020,Love it,5,0.6369,Positive,2
2021,"Would like to use all of the functions, to elimate cable all together.",5,0.3612,Positive,13
2022,kids lost orginal,5,-0.3182,Negative,3
2023,"When u use it there is a delay. To switch channels and raising volume lowering it.
I'm using a fire cube",1,-0.6908,Negative,21
2024,Replacement remote for fire TV.,5,-0.34,Negative,5
2025,Love having vol control,5,0.6369,Positive,4
2026,Awesome !!! Better than thd original remote control Love my Remote and I love Amazon firestick,5,0.9651,Positive,16
2027,My old remote did not work anymore so I order a new one and the remote was the same,5,0.0,Neutral,19
2028,"Paid $30, there was a 4k firestick (with remote) for $30 ish dollars the next week.",1,0.0,Neutral,16
2029,I like that i can control my tv with one remote.love it,5,0.3612,Positive,12
2030,Remote didn’t work only rated 1 star to leave a comment,1,-0.0516,Negative,11
2031,Won't pair with fire tv cube.,1,0.2584,Positive,6
2032,Did not work at all,1,0.0,Neutral,5
2033,The best remote Amazon hasn't granted,5,0.6322,Positive,6
2034,Really enjoyed the control and shipping was very fast.,5,0.5563,Positive,9
2035,It's nice to have one remote to control the TV & Sound Bar. Works perfect easy to set up.,5,0.8555,Positive,19
2036,This remote works just as advertised and I love it!!!!,5,0.7482,Positive,10
2037,So nice to finally not have to reach for my other remote to adjust the volume.,5,0.4623,Positive,16
2038,love the voice on the remote,5,0.6369,Positive,6
2039,Can’t get the voice recognition to work but everything else is great,4,0.7684,Positive,12
2040,"Ordered 2, it came sooner than expected. Awesome experience and I would definitely order again!",5,0.7959,Positive,15
2041,Easy set up,5,0.4404,Positive,3
2042,Intergrated it in to an existing Fire Cube with ease.,5,0.0258,Neutral,10
2043,Will not pair to my fire TV,2,-0.34,Negative,7
2044,Stop working after 3 months,3,-0.296,Negative,5
2045,"Need a controller because my original broke, this works well with original firestick",5,0.4404,Positive,13
2046,"Ordered this product in September, by March it was dead again. Not worth the money or hassle.",1,-0.7154,Negative,17
2047,As soon as I put the batteries in and rebotted my firestick the remote connected immediately!,5,0.0,Neutral,16
2048,Mother in law likes her new fire stick.,4,0.1027,Positive,8
2049,Awesome,5,0.6249,Positive,1
2050,Works well so far had it for a week. Connection process was easy.,5,0.6124,Positive,13
2051,I lost my old firestick remote I purchase a new one It was easy to use and easy to setup Happy with my remote thank,5,0.8658,Positive,25
2052,List my remote fast delivery and works great,5,0.6249,Positive,8
2053,Not working needs to be replaced asap,1,0.0,Neutral,7
2054,Doesn’t always pick up commands other than volume but it’s much more convenient than the original remote.,5,0.4497,Positive,17
2055,see headline,5,0.0,Neutral,2
2056,"Finally, I can watch prime without 3 controllers!",5,0.0,Neutral,8
2057,This is what Fire TV needed to become perfect! Easy to set up and even easier to use. My TV remote is now in a drawer. Love it!,5,0.915,Positive,28
2058,"I don't have an Alexa tv,and it doesn't work with a Phillip's tv",5,0.0,Neutral,13
2059,I love it!! Makes using fire stick so much easier,5,0.7552,Positive,10
2060,"Well I loved it, but for $10 more you get it all!",3,0.5093,Positive,12
2061,Works great,5,0.6249,Positive,2
2062,I like to have my room dark and with voice remote I don't need the light to change channels or programs.,5,0.3612,Positive,21
2063,I love that I can turn the volume anyway I like.,5,0.7717,Positive,11
2064,Works like a charm,5,0.6369,Positive,4
2065,Does not work with all fire devices,4,-0.34,Negative,7
2066,Love it 😍,5,0.802,Positive,3
2067,I did not like my order that I received it did not come with a Firestick wasn’t satisfied with my order,1,0.1754,Positive,21
2068,Excellent,5,0.5719,Positive,1
2069,Great product! Recommend to anyone,5,0.784,Positive,5
2070,Did not pair to my TV,2,0.0,Neutral,6
2071,Totally worth the money to upgrade and have one remote control everything.,5,0.2944,Positive,12
2072,Great buy,5,0.6249,Positive,2
2073,Since buying this fire stick I have not missed my cable box at all. I can download apps to watch my all my favorite shows without a cable box. It’s easy to use. I love it.,4,0.8496,Positive,36
2074,All of my Amazon Products makes life better!,5,0.5983,Positive,8
2075,This remote completely lives up to all of the specs and promises. Love my fire stick,5,0.6597,Positive,16
2076,Works great really easy to set up,5,0.807,Positive,7
2077,WOuld not pair with my fire stick,1,-0.34,Negative,7
2078,remote does not work,1,0.0,Neutral,4
2079,It was a perfect fit,5,0.7351,Positive,5
2080,"I was worried that the remote wouldnt work with my tv, but I am 100% satisfied with my with my remote",5,0.4767,Positive,21
2081,I worked just like the original.,5,0.5859,Positive,6
2082,Every thing,5,0.0,Neutral,2
2083,works great but for the money I thought the unit that plugged into the tv came with it,4,0.3716,Positive,18
2084,You don't have to use 2 remotes all the time. And Alexa is better than my voice on my cable remote.,5,0.4404,Positive,21
2085,"All the mechanics work well, but this is my third fire stick in two years they just don't last long.",1,-0.3716,Negative,20
2086,2nd replacement remote and still not working,1,0.0,Neutral,7
2087,Hooked up easy. I don't have a problem with any controls voice commands so it's good!,5,0.8238,Positive,16
2088,This remote worked perfectly with my Samsung TV. Very easy to program.,5,0.8122,Positive,12
2089,Love the features of being able to power on and off and control volume,5,0.6369,Positive,14
2090,"Super easy to setup and love the universal control of power, volume and programming!",5,0.906,Positive,14
2091,Was having problems with my original firestick remote. Amazon sent me this replacement for free 😊,5,0.8625,Positive,16
2092,"Very easy to sync to your fire stick. Also, it easily syncs to your tv in order to control volume.",5,0.4927,Positive,20
2093,Love it! The mic and volume controls make this a must have,5,0.6696,Positive,12
2094,excellent product,5,0.5719,Positive,2
2095,Bueno,4,0.0,Neutral,1
2096,i love this item!,5,0.6696,Positive,4
2097,This Remote control does not pair with the amazon fire tv Please help,5,0.5106,Positive,13
2098,I can now control my tv off/on and volume on one remote,5,0.0,Neutral,12
2099,Works well had no problems connecting to my fire stick.,5,0.2401,Positive,10
2100,Sometimes it can not hear your words that well. It’s great replacement for remote.,5,0.7351,Positive,14
2101,great,4,0.6249,Positive,1
2102,Does it’s job,4,0.0,Neutral,3
2103,I just need a replacement remote and I’m glad I found it on here for a good price,5,0.7096,Positive,18
2104,Way over priced but the product is great,5,0.7684,Positive,8
2105,Wonderful product,5,0.5719,Positive,2
2106,Quality,5,0.0,Neutral,1
2107,It works.,5,0.0,Neutral,2
2108,My old remote got chewed by my dog. Got this one to replace it. Linked it and it works great!,5,0.6588,Positive,20
2109,The best one I’ve had yet,5,0.6369,Positive,6
2110,"Works as advertised. Took a minute to reset system, but instructions were clear and precise.",5,0.5267,Positive,15
2111,Works great!,5,0.6588,Positive,2
2112,Always great,5,0.6249,Positive,2
2113,Needed a new one perfect,5,0.5719,Positive,5
2114,Very happy. Took less then 2 min. To pair with my Amazin TV Cube,5,0.6115,Positive,14
2115,Thought I could use my product but only the wrong thing came it was the fire remote for tv,1,-0.8047,Negative,19
2116,"well worth the price, amazon has never failed me!!!",5,0.8062,Positive,9
2117,It works great,5,0.6249,Positive,3
2118,Nice remote,5,0.4215,Positive,2
2119,Great upgrade! Synced immediately to my firestick.,5,0.6588,Positive,7
2120,This remote is perfect.,5,0.5719,Positive,4
2121,It stopped working after 6 months. Disappointing.,3,-0.6249,Negative,7
2122,I love it.,5,0.6369,Positive,3
2123,Works great but would love a remote that comes with an app to locate it! Lol,5,0.9238,Positive,16
2124,Did not work waste of money now I have a fire stick i cant use,1,-0.0176,Neutral,15
2125,The product was cost effective easy to set up and works great.,5,0.8779,Positive,12
2126,I bought this as a gift for friend he loves it & it's always in his hand. 😊,5,0.9584,Positive,18
2127,Excellent,5,0.5719,Positive,1
2128,"Everything worked smoothly, out of the box.",5,0.0,Neutral,7
2129,Easy to install. Don't have to use several remotes anymore. Streaming is much better. Glad I upgraded.,5,0.8316,Positive,17
2130,I love it! I don't have to use my TV remote anymore because it does it all.,5,0.6696,Positive,17
2131,Worked slick and easy,5,0.4404,Positive,4
2132,Stopped working after a few months,1,-0.2263,Negative,6
2133,Replacement for the one my dog ate. Very easy to switch over.,5,0.4927,Positive,12
2134,Great one remote to control all.,5,0.6249,Positive,6
2135,"I have changed 3 out of 4 fire sticks in my house to this remote. Best decision ever! Since we only watch tv using the fire stick, I no longer need two remotes! It even controls my sound bar!",5,-0.3971,Negative,39
2136,"Super easy to set up. Had to order twice, new puppies are jerks, ha ha ha",5,0.8979,Positive,16
2137,the volume or power button doesnt work at all.,2,0.0,Neutral,9
2138,Perfect. Does exactly what it's supposed to do. I'm very pleased with this item. Thank you Amazon.,5,0.8777,Positive,17
2139,More functions and works very well,5,0.3384,Positive,6
2140,Gifted,1,0.0,Neutral,1
2141,I like this controller better than the first one because this one has the volume on it,5,0.6597,Positive,17
2142,"Best decision, easy set up, linked right to TV, even auto programmed power, volume, and input controls",5,0.7964,Positive,17
2143,Works as described,5,0.0,Neutral,3
2144,I like it and it came just in time,5,0.3612,Positive,9
2145,I only wish my dog would stop grabbing these. Now on the 4th one. Still a good device,5,0.5267,Positive,18
2146,I LUV LUV & LUV THIS WAY OVERDUE UPDATED AMAZON REMOTE..,5,0.347,Positive,11
2147,Worked Perfectly. Perfect replacement. Zero Issues. YES!,5,0.9122,Positive,7
2148,Great value!,5,0.7777,Positive,2
2149,Love it,5,0.6369,Positive,2
2150,Works great and the power and volume buttons eliminates the need for a second remote,5,0.6249,Positive,15
2151,All it said it was. Took awhile to sync with fire stick but it works like it should.,5,0.3716,Positive,18
2152,Works like it is supposed to.,5,0.3612,Positive,6
2153,"Adding the volume control is a huge step plus!!! Turns on everything on my system (TV, amplifier, etc)...",5,0.4898,Positive,18
2154,I absolutely love this remote.,5,0.6697,Positive,5
2155,Would not connect to my tv no matter what,2,-0.0191,Neutral,9
2156,Perfect!! I love the fact that it have a volume control especially voice control .,5,0.8585,Positive,15
2157,A single device controls all my devices.,5,0.0,Neutral,7
2158,Great item. Came super fast easy to use.,5,0.8979,Positive,8
2159,Worked just like it should,5,0.3612,Positive,5
2160,The set up was easy to do.,5,0.4404,Positive,7
2161,"This did not work. After multiple attempts to pair with my fire tv, I needed a replacement.",1,-0.34,Negative,17
2162,"Much more convenient for my setup (ex: sound bar, TV, Fire TV Cube)",5,-0.34,Negative,13
2163,I needed a replacement and this is better than the one I originally had gotten with my Fire stick.,5,0.128,Positive,19
2164,It was really easy to set up and it works great,5,0.807,Positive,11
2165,Thanks for the great service and produy,5,0.7906,Positive,7
2166,Nice step up,5,0.4215,Positive,3
2167,This is our second remote in a year..they keep dying,2,0.0,Neutral,10
2168,All functions work great!,5,0.6588,Positive,4
2169,One of the best controllers. Works amazing with my samsung tv!,5,0.8516,Positive,11
2170,I love my fire stick and of course found my old remote the day the new one came,5,0.4215,Positive,18
2171,Works great,5,0.6249,Positive,2
2172,Didn’t work,1,0.0,Neutral,2
2173,Works great,5,0.6249,Positive,2
2174,It works great we live it.,5,0.6249,Positive,6
2175,Good remote.,5,0.4404,Positive,2
2176,Great buy.,5,0.6249,Positive,2
2177,Direct replacement was perfect,5,0.5719,Positive,4
2178,Easy to set up and love that I can control the volume on my tv.,5,0.7964,Positive,15
2179,Great improvement from the previous model remotes,5,0.7964,Positive,7
2180,The ability to control the sound and turn off tv.,5,0.3182,Positive,10
2181,"Your browser does not support HTML5 video.
 I like the features
It has",5,0.0624,Positive,13
2182,love love,5,0.8555,Positive,2
2183,The remote stops working frequently,5,-0.1531,Negative,5
2184,So glad I can now use one remote to control both TV and Firestick,5,0.5095,Positive,14
2185,"Not compatible with firestick, what is the point in buying it!",1,0.0,Neutral,11
2186,I was able to add YouTubeTV to my apps just by using Alexa. Very impressive!,5,0.5974,Positive,15
2187,This remote has failed to pair with my firestick,1,-0.5106,Negative,9
2188,Love it. No problems programing to my television,5,0.7549,Positive,8
2189,I programmed the remote to work with my TV but it will not control my volume,3,0.0,Neutral,16
2190,Returned,1,0.0,Neutral,1
2191,Its good,5,0.4404,Positive,2
2192,Replacing the remote that I set on,5,0.0,Neutral,7
2193,Works just the like original one that came with my fire cube works great,5,0.7579,Positive,14
2194,It doesn't work. It’s easy to work.,2,-0.3412,Negative,7
2195,"Great product, removed the need for two remotes",5,0.6249,Positive,8
2196,"Won’t stay paired, waste of money",1,-0.4215,Negative,6
2197,Love Firestick and its controller,5,0.6369,Positive,5
2198,Having all in one remote is great,5,0.6249,Positive,7
2199,easy set up,5,0.4404,Positive,3
2200,ARRIVED FAST AND NICE PACKING !!!,5,0.6607,Positive,6
2201,Remote works great love the voice recognition.,5,0.8519,Positive,7
2202,Loose battery door and will not pair,1,-0.3182,Negative,7
2203,Product arrived and hopeful that it will last!,5,0.5562,Positive,8
2204,Awesome product !!!,5,0.7163,Positive,3
2205,Everything on the remote sticks and I have to double click way too often.,2,0.0,Neutral,14
2206,I ordered 2 remotes and had them paired within 10 min along with pairing on with a soundbar. Very easy and got rid of 3 other remotes.,5,0.4927,Positive,27
2207,Works exactly like it should!! Good quality!!,5,0.7627,Positive,7
2208,Love the fire stick s. My grandkids love them,5,0.7906,Positive,9
2209,Love voice options,5,0.6369,Positive,3
2210,Does what it's supposed to do!,5,0.0,Neutral,6
2211,Dont have to use with TV remote,4,0.0,Neutral,7
2212,Replacement for original remote,4,0.3182,Positive,4
2213,Absolutely love that it has the power button and volume controls!,5,0.6989,Positive,11
2214,very good. paring was easy and Ive had no trouble with this replacement.,5,0.8101,Positive,13
2215,Works great love it I can literally watch whatever I want!! 😃😊😀☺💎✨😲,5,0.98,Positive,12
2216,"Works like magic
Let’s just hope my dog don’t eat this one
Lol",5,0.802,Positive,13
2217,I like everything,5,0.3612,Positive,3
2218,Good,5,0.4404,Positive,1
2219,Easy to program. Works great!,5,0.807,Positive,5
2220,Worked perfect!!! I’m happy ;),5,0.88,Positive,5
2221,Perfect buy at a perfect price,5,0.8126,Positive,6
2222,"Buffers and lags all the time ,waist of money",1,-0.3612,Negative,9
2223,The remote will not pair with the tv after about 20 attempts I gave up.,1,0.0,Neutral,15
2224,Love this remote,5,0.6369,Positive,3
2225,It works ok batteries are not long lasting,3,0.296,Positive,8
2226,So easy to use!,5,0.54,Positive,4
2227,I have bought 3 and all of them stop working after 3 months very upset,1,-0.624,Negative,15
2228,My remote is a Life Saver.. It works very well as my replacement xo,5,0.3384,Positive,14
2229,I like that i dont have to be switching remotes for volume and power.. It will be awesome if channel up/down buttons were added... Overall great product.,5,0.8934,Positive,27
2230,I GENERALLY LIKE THE PRODUCT,4,0.3612,Positive,5
2231,"Does not work, refund please",5,-0.2411,Negative,5
2232,"Great product, fast shipper!",5,0.6588,Positive,4
2233,Love the volume control! Works great!,5,0.8715,Positive,6
2234,It working is like a miracle. These things are horrible,1,0.4215,Positive,10
2235,I love it. It is better than the original,5,0.8555,Positive,9
2236,This is a 4K remote that says it pairs with 2nd generation but this Does Not work with 2nd generation fire TV sticks!,1,-0.5255,Negative,23
2237,It will not pair with my fire TV. It is Crap!,1,-0.6476,Negative,11
2238,It came broken and every time I try to do a return it won’t let me.,1,-0.4767,Negative,16
2239,My replacement remote NEVER worked!!! So I returned th eff m both.,1,0.0,Neutral,12
2240,Great product now we only use one remote to turn on/off TV and adjust the volume!!!,5,0.7163,Positive,16
2241,This remote worked perfectly as a replacement remote,5,0.6369,Positive,8
2242,Love not needing a separate remote to adjust volume!,5,0.6696,Positive,9
2243,Awesome!!!!,5,0.7405,Positive,1
2244,Just right!,5,0.0,Neutral,2
2245,No dislikes,5,0.3089,Positive,2
2246,Good remote,5,0.4404,Positive,2
2247,Easy to use,5,0.4404,Positive,3
2248,"Great remote! Works with my Samsung TV, Vizio soundbar. Small and perfect!",5,0.855,Positive,12
2249,great back up remote when my kids lost my regular remote,5,0.4215,Positive,11
2250,Easy to program and gets rid of multiple remotes!!!,5,0.5826,Positive,9
2251,Was not compatible and was not able to get a refund. Disappointed,1,-0.4767,Negative,12
2252,Lost the first one bought a second one and it works just as good!,5,0.2244,Positive,14
2253,"Works perfectly, met my expectations!",5,0.6696,Positive,5
2254,Works fine,5,0.2023,Positive,2
2255,Easy to sync with my tv,5,0.4404,Positive,6
2256,Works good kinda glitchy and messes up a quite bit,4,0.4404,Positive,10
2257,Works perfect,5,0.5719,Positive,2
2258,Very slim and sleek very operative,5,0.0,Neutral,6
2259,Functions very well was much needed,5,0.3384,Positive,6
2260,Love it!!,5,0.6988,Positive,2
2261,This was a replacement,5,0.0,Neutral,4
2262,Works when it wants to,1,0.0,Neutral,5
2263,had to buy another,5,0.0,Neutral,4
2264,Having volume and mute together on it is awesome.,5,0.6249,Positive,9
2265,I like everything about this remote,5,0.3612,Positive,6
2266,Nothing,5,0.0,Neutral,1
2267,Works great with my LG TV and Samsung SoundBar.,5,0.6249,Positive,9
2268,The remote was easy to set up and it works with my emerson tv,5,0.4404,Positive,14
2269,don't work no institutions return,1,0.2235,Positive,5
2270,Annoying it didn’t work yet I’m paying shipping to return it.,1,-0.4019,Negative,11
2271,Worked as expected.,5,0.0,Neutral,3
2272,Finally a remote that works with all my devices.,5,0.0,Neutral,9
2273,I've bought several they only work for about a month or two.,1,0.0,Neutral,12
2274,Thos is better than the remote that came with the device because it also can control the TV,5,0.4404,Positive,18
2275,Is not working for my firetv box,1,0.0,Neutral,7
2276,This does not work or connect to any of my Toshiba fire TVs,1,-0.34,Negative,13
2277,Awesome product worth the money,4,0.7184,Positive,5
2278,This remote is useless with first generation fire stick ...,1,-0.6369,Negative,10
2279,Yeah,5,0.296,Positive,1
2280,Like,5,0.3612,Positive,1
2281,I rate it 5 stars,5,0.0,Neutral,5
2282,We absolutely love this generation of the fire stick. Easy to use and the volume control is a definite plus!,5,0.8118,Positive,20
2283,"the remote works great, real easy to set up.",5,0.7906,Positive,9
2284,I love I will give it 5 stars,5,0.6369,Positive,8
2285,Works great.,5,0.6249,Positive,2
2286,Don’t know why I waited soooo long to get one .,5,0.0,Neutral,11
2287,Easy to replace the batteries,5,0.4404,Positive,5
2288,I am glad that it has volume control access,5,0.4588,Positive,9
2289,Works very well,5,0.3384,Positive,3
2290,Difficult to setup,1,-0.3612,Negative,3
2291,I didn’t used it until now.,5,0.0,Neutral,6
2292,"After trying everything, it would not pair with the TV.",1,0.0,Neutral,10
2293,It does not work with my tv,1,0.0,Neutral,7
2294,Best echo dot,5,0.6369,Positive,3
2295,It operated the way I thought it should.,5,0.0,Neutral,8
2296,I cut the cord and use this to control both my fire TV and television. Works great!,5,0.2244,Positive,17
2297,Had this remote 10 days and the sensor stopped working,2,-0.2263,Negative,10
2298,Great for my Amazon firestick.love it.,5,0.7003,Positive,6
2299,Its good ^^,5,0.4404,Positive,3
2300,Works great!,5,0.6588,Positive,2
2301,Works great. Love only having to use 1 remote!,5,0.8622,Positive,9
2302,Need to make more Durable,5,0.0,Neutral,5
2303,Works well.,4,0.2732,Positive,2
2304,I love this,5,0.6369,Positive,3
2305,The voice remote makes it so easy to control the tv,5,0.5777,Positive,11
2306,like everything about it,5,0.3612,Positive,4
2307,The best thing ever made,5,0.6369,Positive,5
2308,Works great! Good replacement remote. Easy to set up,4,0.8805,Positive,9
2309,Easy to pair with existing Firestick.,5,0.4404,Positive,6
2310,A little pricey but works as expected,5,0.0,Neutral,7
2311,I love it works perfect,5,0.836,Positive,5
2312,I like it,5,0.3612,Positive,3
2313,Good replacement for original remote,5,0.6369,Positive,5
2314,it didn't work,4,0.0,Neutral,3
2315,I can’t get this remote to pair with my fire stick,1,-0.34,Negative,11
2316,I love everything about my firestick,5,0.6369,Positive,6
2317,Worked for a while (about 2 weeks) and then completely quit. We tried changing the batteries and nothing we did helped.,1,0.0,Neutral,21
2318,It doesn't work for my boss won't to send it back,1,0.0,Neutral,11
2319,Works great used it for our older model firestick,5,0.6249,Positive,9
2320,No work in Samsung tv,1,-0.296,Negative,5
2321,"I have 3 Fire Sticks
All remotes work perfectly",5,0.4215,Positive,9
2322,not very easy to use.,2,-0.3865,Negative,5
2323,Cost way too much!!!!,4,0.0,Neutral,4
2324,Perfect,5,0.5719,Positive,1
2325,Amazing,5,0.5859,Positive,1
2326,love it,5,0.6369,Positive,2
2327,Remote is awsome!!! I could do it all with it!!!,5,0.0,Neutral,10
2328,Everything about it. Watch it for movie/tv show.,5,0.0,Neutral,8
2329,Love the fact it controls everything with one remote.,5,0.6369,Positive,9
2330,Awesome even batteries last longer,5,0.6249,Positive,5
2331,Great works perfect,5,0.8316,Positive,3
2332,Super fast shipping!!! Thanks!!!,5,0.8388,Positive,4
2333,Great,5,0.6249,Positive,1
2334,my family love it. they like talk to the voice,5,0.7717,Positive,10
2335,this remote works great,2,0.6249,Positive,4
2336,The cube is better,4,0.4404,Positive,4
2337,I liked everything about it works really good,5,0.7178,Positive,8
2338,Great new remote only wish for a mouse option,4,0.7783,Positive,9
2339,Works as expected with no issues or concerns.,5,-0.296,Negative,8
2340,Voice recognition,5,0.0,Neutral,2
2341,I loved it. works,5,0.5994,Positive,4
2342,It works much better than the Nvidia ShieldTV remote.,5,0.4404,Positive,9
2343,Use thicker plastic so back cover stays put.,3,0.0,Neutral,8
2344,Amazon Firestick,5,0.1779,Positive,2
2345,As expected,5,0.0,Neutral,2
2346,"Works great, replacing the one the dog ate.",5,0.6249,Positive,8
2347,Not working 😪,1,0.0,Neutral,3
2348,It works great!,5,0.6588,Positive,3
2349,I absolutely love the remote!,5,0.6989,Positive,5
2350,It works like piece of cake !,5,0.4199,Positive,7
2351,Love it,4,0.6369,Positive,2
2352,Replacement for lost remote to fire stick.,5,-0.5719,Negative,7
2353,Worked perfect,5,0.5719,Positive,2
2354,Right on time everything was perfect!,5,0.6114,Positive,6
2355,Was great. Already stopped working,3,0.4939,Positive,5
