,reviews,stars,Compound Score,Sentiment,word_count
0,"As soon as we found this new fire tv remote to support TV power/volume functions we pre-ordered one on Amazon. Just as usual with Amazon prime, the shipping was superfast. It arrived on the first day it became available, which was totally a surprise. Upon receiving it we tried it with the fire TV stick we bought earlier this year for our bedroom TV (I hated to keep two remotes, 1 for TV and 1 for FireTV, by our bed, and very eager to get rid of them).
I put in batteries, nothing happened. Next, we looked into the user guide for instructions on how to pair the remote, no info. Last, we googled internet and found out, you just need to press any button on the remote a few time, and the remote will pair by itself. Even the pairing is automatic I wish there is better documentation. Otherwise, it's very confusing to the user whether it's connecting or not. Anyway, the remote got paired to the FireTV stick, it seems working just like the original remote except for controlling the Power and volume, which is the main reason to have this new remote. It doesn't work with our TV, which is also we got new in this year. When pressing the Power button the TV became dark, but it didn't actually shut off the TV, it's just like in the sleep mode for pc. For the volume buttons it simply does not have single response when pressing them. Again, there is no instructions for how to use and troubleshoot, and no technical support or anything. You have no way to know if you did something wrong or it's just incompatible with our TV, even though we noticed on our Amazon profile it had already recognized and recorded our TV brand, which indicates there is some info exchanged correctly...
Overall this is just a poorly engineered product, very disappointed!",1,-0.8929,Negative,320
1,"I bought this product with all of the things thinking that need to replace the remote for my Amazon fire box. Took a little bit to configure the remote. Then when I finally got it working it stopped after about 5 minutes. No power to the remote at all. And I replace the batteries three different times and the same result. It seems like the only time that it will work is when I completely unplug and plug back in my box, and it will only work for a few minutes while I am actively using it.",1,0.0,Neutral,97
2,"I purchased the fire TV cube several months ago. It works very well controlling my AVR and TV over HDMI-CEC. That is - it doesn't use IR codes to control devices (which is very error prone) but sends signals on the HDMI cable.

The problem is that the only way to increase the volume was to yell at Alexa or use the fire TV app on your phone. My kids were mystified - I brought them a new box to watch TV and it didn't have a volume button?!? It seems like a huge miss.

In any case, this new product fixes the volume button problem. It works flawlessly with my fire TV cube after I paired the remote. As to the product manager that decided to ship the fire TV product without a volume button... wow.",5,-0.5271,Negative,137
3,Paired in few minutes and won't stay paired also the volume and mic doesn't work,1,0.0,Neutral,15
4,"The remote works perfectly for my setup - Vizio TV, Vizio soundbar, and FireTV Ultra 4K Pendant. I don't have cable nor an AV receiver, so it is about as simple as you can get. I have the soundbar plugged into the HDMI ARC so the TV itself controls the volume.

In that configuration, the mute and volume controls control the TV volume, which in turn controls the soundbar volume. If you have the same kind of setup, once you have paired the remote with the TV, you are all done. In fact, pairing with the soundbar will NOT work and will remove your ability to control the volume.

The setup directions are very sparse because it is supposed to be self-guided by software once you pair to your FireTV. However, if you make a mistake ( I did by accidentally choosing the wrong TV brand) and don't get your TV choice done, there is no way, at least no obvious way in the guided setup, to re-choose your TV. So you end up with what you think is a 'bricked' remote.

Take heart, there is help, albeit obscure. You just need to go online to Amazon's Help section, for Amazon Devices, then choose the new remote. It's at this link: https://www.amazon.com/gp/help/customer/display.html?nodeId=G47P2QLV6DKLKA6P

In the help section you will see how you can go to the Settings of your FireTV device and choose Equipment Control which will let you manage your equipment setup. What was really frustrating is, if Amazon had just added an extra section on the fold up directions, they could have put those helpful tips right in the box. Instead, the entire back of the directions were taken up with useless disclaimers and legalese. So the remote is very slick once paired, but the directions, if you make a mistake, are not worth the paper they are printed on. I do have to say, that the online help is really excellent AND it includes a video. Why they didn't put something more helpful in the directions, something as simple as ""If you have any trouble, visit the HELP section on Amazon.com"", is beyond me.

Now, with the remote correctly paired to my TV, I have the perfect single remote to turn my TV on and off, control the volume up or down, mute, and control everything on my FireTV. I previously used a Harmony 1100 to control my whole AV stack, but since I simplified my setup, this remote makes it a single remote solution to give me control but reduce clutter. Highly recommend.",5,0.9845,Positive,426
5,"I like the ability to increase/decrease volume or mute and the new power button. But the new plastic and manufacturing is very cheap. Rough edges, gaps, molding flash. The older remotes were of much higher build quality.",3,0.34,Positive,37
6,I would return this but had already tossed the box. Paired quickly and seemed to work fine but when the new Toshiba TV shut off the remote couldn't turn it back on. Thought the voice control might turn it on only to discover that didn't work either. (Dog ate the original remote) Finally located the correct Toshiba remote and have ordered that.,1,0.631,Positive,62
7,"First, I know tech.

I struggled to get it to work the first time. I paired and unpaired 3 times over 3 days. The final time was a charm. It is worth it once it works. The TV tells the firestick what the remote should do.

Steps. 1 Pair the device.
2. The firestick updates.

The real issue is that the instructions give no indication about the remote updating. Just says pair the device and your done. Well, if it didn't update properly and the volume buttons don't work it should specifically state to try again and even show what to expect. Even a manually update would help.

I did call tech. Spoke to 3 reps. No one had a clue what I was trying to do. Interesting that Amazon could get on my tv and take control. Bizaar yet didn't help at all. Service rep was confused and hard to understand.

Overall product is great. Just need clarity on set up.

**** update. After working correctly, it failed again. Discovered 2 things. First, there is a manual update once paired correctly. Its in the settings tab. Equipment control or something like that. I setup this way a second time and it worked again.

Also, when you setup, the remote says to plug into the original usb adapter. Do this instead of the TV. The setup says that it needs the right power supply. I know the tv provides the correct power so I moved on. However, the install stalls when you shut the tv off and the stick powers off. It continues upon restart but when I tried this a few times and it stopped when i kept constant power to the stick while I shut the tv on and off.

It works.. Keep tinkering.",5,0.4255,Positive,296
8,"EIGHT MONTH UPDATE: Bad Luck had me with a ""replacement"" Fire TV Pendant (3rd Gen, etc) and out of the box the Pendant was a ""brick"" since it would not detect/operate using the Nov 2018 2nd Gen remote. Hold Home Key till thumb went numb, un-pair, factory reset, power off/take out batteries/stand on head - no dice. Re-read the part of the review that mentioned the Odd Little Update that appeared JUST AFTER the 2nd remote was hooked up in Nov 2018.. ...Yes. Did need a 1st Gen remote to get past the Fire TV's First Run Screens.. ...then an update was downloaded/installed to make the Pendant compatible with the 2nd Gen remote. Once that was done - pressing down the Home Key on the 2nd Gen remote took seconds. To Confirm This: Removed the 1st Gen remote from settings and then took the batteries out of the 1st Gen remote - it has earned it's rest! Then factory-reset the Pendant and (to be extra annoying) un-paired the 2nd Gen remote (left/back/menu). The Un-paired 2nd Gen remote was still able to be re-detected by the factory-reset Pendant at the First Run Screens. So looks like it is confirmed that a 1st Gen remote is needed INITIALLY to allow the download/installation of Some File that only becomes available when a 2nd Gen remote is detected. Suggestion: Perhaps the Fire TV Reps should possibly test/configure/refurb Pendants using the 2nd Gen remote before shipping them out to customers. That way the Pendants might have support for the 2nd Gen remotes Out Of The Box?

(useless 2018) UPDATE: Looks like Luck is with me. The fourth person I spoke with said that the issue with the activity lights and ""Battery Offline"" is normal. I also figured out for myself that an *inactive remote* ALWAYS reports itself as ""Battery Offline"", which just means that my new remote is actually OK, it just took a few tries (?) to get it to ""pair"" properly. (?) << 2019 Edit - it was that file that was installed. Hindsight is 2020! >>
Many thanks to nice (and patient) person at Amazon Fire TV Support for her help with this issue!! :) :) :) :)
Update to the Update: :( See bottom of this boring review for Extra Trivia (software updates/etc)

For those wondering how to ""program"" the new buttons on this version of the remote with TVs and Other Devices
==================================================================================
For Information's sake, while beating my head against the floor over ""Battery Offline"" issues, I was able to see how the remote ""auto-detects"" with devices like my TV to configure the new buttons such as Power On/Off, Volume, etc. After setting up the new remote, another setup screen kicked in and auto-detected my television (""we see you have a Sony TV"") and I was asked to try On/Off and then select whether or not the TV did as it was told. Similar for volume - was asked to press ""up/down"" and then select whether or not it worked. So looks like the IR setup for the new buttons is done by auto-detection of devices rather than manual programming, entering codes, copying from an existing remote, and so forth.

- You can fine-tune this under ""Settings"" by selecting the ""Equipment Control"" category.
- Under Equipment Control//Manage Equipment//Add Equipment, you can add/configure support for additional devices such as a Sound Bar, an Xbox, AV Receivers, etc.. If no ""Equipment Control"" - update Fire Software?
- Some devices may also require the use of Alexa: Etc: ""Alexa.. switch to...X"", etc..

Some Troubleshooting Tips: (which come in handy when your new remote remains inert.)
...all this stuff takes place under Settings, Controllers and Bluetooth Devices, then Amazon Fire TV Remotes...
1) To RESET the remote, hold down THREE BUTTONS SIMULTANEOUSLY: ""Back"", ""Menu"", and ""Left"" (aka: Left side of the Circle). After 5, 10, etc seconds, the remote now should be unpaired/inactive AND IT WILL NO LONGER FUNCTION. However, it will *still show* under available remotes, but will show as ""Battery Offline"". this has NOTHING to do with the status of the battery, it just means this particular remote is now inactive/not currently paired. You cannot delete a remote that is active/in-use, so resetting a remote is one way to make it possible to be removed. Or cheat by taking the batteries out and rebooting your Fire Device, etc. To use the remote again you will need to add it back/re-pair it from the Amazon Fire TV Remotes Menu or patiently via it's Home button. Or just reboot and cross your fingers..
2) To delete a remote, it must be considered inactive first. If it's already inactive (like mine likes to be) just select it and use the ""menu"" button to delete it.
3) If you are stuck with an inactive remote that you WANT to actually use.. one that for some reason did not detect/pair properly (like mine), then try rebooting your Fire device and perhaps also holding down it's Home Button. Maybe delete the troublesome remote from the list and try re-detecting it from the Amazon Fire TV Remotes Menu. Deleting/re-detecting may save your thumb, as it took a looooong time to work just holding down it's Home Button
4) If your remote/s are not paired with your Fire Device, trying holding down that remote's HOME key (for a while) to ""force detection/pairing"". Rebooting the Fire Device wouldn't hurt. Remove batteries, reboot the Fire Device, re-insert..
5) I was told that.. ..uhm.. Using multiple Fire TV Remotes with the SAME Fire TV Device is.. uhm.. Not Supported... IT WORKED (I had one in each hand, and both were going fine..), but it was suggested that I remove one of the two remotes and just have a single remote ""active"" at any one time.

Trivia: Looks like this updated version of the remote is about 1/4"" shorter than the original/previous version.

EXTRA Trivia (1):
No clue if this is Myth or Fact
You *might* need a ""software update"" for this to work correctly... who can say?
- I know (for the Pendant at least) that there was a ""Software Update"" around October 25th or so
- I also know that I *checked* for ""updates"" the *Morning* of November 14th - None Available.
- I also know that when I spoke with an Amazon rep after connecting the new remote on the *Evening* of November 14, I was told to ""check for an update"" and there was a ""New Update"" that was *not* available only a few hours before. (coincidence?)
- I could have sworn that ""Equipment Control"" did not appear till I attached the new remote, but am not 100% sure.
--> To check for Updates: Settings, My Fire TV, About, Check For Software Update (Try this at least TWICE).
--> So far as the Pendant goes, I believe the software rev is NS6255 / 1628 as of Nov 15 2018.

Extra Trivia (2): Was reading some of the other reviews and comments, and one item popped up a bit.. ..a suggestion to use the supplied AC power adapter rather than get power via the TV. I was already using AC power (Pendant) and still ended up with a Phantom Remote for a while, but never hurts to pass on info - just in case.

Extra Trivia (3): Although I think this is listed, the new remote is not compatible with 1st Gen Fire Stick Stuff.

Extra Trivia (4): It was ""suggested"" that I have only one Fire TV Remote ""paired"" at any one time, although I was also told that having multiple remotes would not result in the newer one dropping away. ???

Useless Info: Oddly enough, my regular remote was Rev 137 but the new/upgraded remote was 124. ???

Semi-Disclaimer: I ended up with this remote as it would seem that my original remote is going through batteries at an accelerated rate and I was allowed to get this one as a replacement and only pay the various shipping charges there and back. When this recent one began displaying ""Battery Offline"" and not detecting properly - Fun Times For Me.",4,-0.9458,Negative,1351
9,"Well, they really dropped the ball on this one. How on earth can a trillion dollar company not make a remote with a few universal buttons to control a TV and sound bar? Then they come out with this mess? Someone is losing their job over this one.

Anyway, this is remote is going to work for you or not. There's no way for you to tell before you buy it. What will happen is that once you pair the remote with your Fire TV it should put up with a ""Hey, do you want to set up your TV?"" prompt. If it doesn't, send it back. It looks like it controls stuff over HDMI and not IR. So if you have any sort of video switcher between your Fire TV you are out of luck. Why not just add an IR LED to this thing? Who knows.",1,-0.35,Negative,148
10,"I am very pleased with this new remote. Having recently cut the cord and just having Fire TV on our 2 TVs it is great to have one remote for the bedroom TV that turns the TV on-and-off, adjusts the volume and operates the Fire TV stick. This new remote uses a signaling method that sends the remote commands from the Fire TV down the HDMI cable to the TV set. For everything to work you'll need a 2nd generation Fire TV or newer, and a TV that has ""HDMI-CEC"" capability. That means the TV can handle the commands sent to it over the HDMI cable. Most newer TVs have this feature, even my budget-buy 4 year old Insignia TV from Best Buy has it and it works with this remote.
To help you determine if your Fire TV device works, search you orders to find your order to determine which Fire TV device you have, then go to Fire TV Support and check the generation. If it's 2nd generation or newer you've got half of the puzzle solved.
Also check your TV's manual to see if you have an HDMI input that works with HDMI-CEC. Unfortunately, most sets only have one input that does so you may have to swap your Fire TV to that HDMI input. And, many TV manufacture has a different name for HDMI-CEC and it's capabilities are often turned off by default. Check out this article https://www.guidingtech.com/53974/hdmi-cec-tv-support/ to find out what your TV set manufacture calls the feature and a generic description of how to enable it. For my Insignia TV it is called INLink. My LG TV in my family room calls it SIMPLINK.
If your TV has the HDMI-CEC feature and your Fire TV is 2nd generation or newer, you have the second half of the puzzle solved. Order up! You can have reasonable confidence HDMI-CEC technology will work for you. (Reasonable... not perfect. This is techie stuff after all.)
Finally, when your new remote arrives, the instruction booklet will get you started pairing the new remote with your Fire TV and then an onscreen tutorial will walk you through testing each of the HDMI-CEC features.
Enjoy!",5,0.1727,Positive,364
11,Okay layout is decent dislike the feel of the remote he comes across as very cheap both in texture on the remote being a super smooth no grips the battery casing does not sit in its housing well it's continually giving this cheap feel of movement I like the ability to have the volume up and down in the mute button and the power for your TV and AV receiver other equipment is nice but everything on the remote itself feels to be of cheap grade plastic would have preferred to see it as an aluminum remote. I know remotes are made in plastics and have been for years like from the 80's . But making it have a heavier weight that makes it feel strong would be nice. Amazon older remote with Alexa felt more robust and not as cheap. The Samsung remote that i have pictured is a great look and feel,2,0.9817,Positive,154
12,"OK, I spent 15 minutes trying to get the cover off this remote to insert the batteries. It is slick and you cannot grip it. There is NOTHING in the directions or on the web to show how the compartment door opens. There are no markings on the compartment door. I compared it to my original controller and surmised it could not go in the same direction because you can see where it meets the body. I surmised the door has to be slid down . Try as I may I could not get the battery compartment door to open, frustrated I finally got it to move slightly by forcing a sharp knife blade into the crack. Finally it moved enough to slide off. I inserted the batteries, set my fire TV to Fire remote pairing, held the home button. NOTHING. Checked batteries, OK, Tried new batteries, NOTHING. THis is a major disappointment Amazon-come pick it up.",1,-0.8932,Negative,157
13,"What a disappointment. The new remote paired seamlessly with my second generation Fire TV stick. It controlled power and volume on my Panasonic plasma set on the first try, and added switching control on a later try. It also recognized my Comcast X-1 cable box immediately, and I am fairly confident I will be able to use the voice command to change channels if I can ever solve the problem that inspires this review.

I spell out all the things that work because they lead me to conclude that I do NOT have a defective device.

So much for the good news. The bad news is that the remote simply refuses to recognize my Emotiva UMC-200 device that I use to control switching between devices and to control volume to my 7.1 speaker setup. Amazon includes Emotiva on its long list of products that will work with their remote and Amazon does not list any limits on how it works. Amazon troubleshooting pages appear to be limited to making sure that CEC is activated.

I hope to update this review someday to a higher score. For now, this remote does no more than the first generation Alexa voice remote that came with the Fire stick.

UPDATE - Rating increased from two to five stars. Within a few hours of posting my initial review I received an email from Amazon asking me to schedule a time for them to call and help with my problems. They asked for 48 hours and called about 50 hours from the time I wrote back.

Paula said she had no experience with my equipment, but she did have detailed notes from her tech department. We followed through the steps suggested. There were a few hiccups, but we got the remote synced with the Emotiva, and later with my Comcast X-1 and Roku box in fairly short order. When we hit snags, she was able to message her tech guru and get back on path fairly quickly.

I am very impressed that Amazon provided this level of customer service this quickly on a product at this price level. While I am not completely sure of this, I think they actually did an update of their programming for my particular Emotiva device.

The best trick I can pass on from this experience is to keep clicking YES, even when the answer is no. It asked me to power down my processor, then asked if it worked. I said yes when the answer was no. Then it asked me to try using the volume control, and asked if that worked. It didn't but I said it did. I then made a mistake which returned me to the home page. Power did not work, said yes, then tried volume. This time it worked! It then asked for some HDMI info and then to use my original remote to change to any other input. Pushing the fast forward button then returned me to the Fire home screen. And pushing the Power button then turned the whole system off.

The remote seems to learn more and to offer more setting options the further you get into the setup process. Go through it again and if things are working, you get still more changeable options.

The remote is not perfect. It does not have enough buttons to do everything you might want done, and an awful lot of switching gets done by voice instead. You need to be very patient waiting for some of the voice commands to take. Still, I think it is very good value for the price. Paula and her customer service team did a great job for me on this one.",5,0.9742,Positive,613
14,"If it doesn't detect your equipment the only option is to add control of a TV. I have my FireStick plugged into an A/V receiver, can't control the receiver. No way to add the receiver as equipment. No way to detect the receiver. No instructions about setting up infrared part of the remote whatsoever. Amazon help no help whatsoever. Works great on the living room TV. Does not work on my other two setups with A/V receivers.",2,0.1635,Positive,77
15,"I ordered this when I lost my original remote, which I had used for about 18 months.
I was excited that this ""improved"" version had Alexa on it, controlled the volume & turned on the tv unlike the first version.
Little did I know that it usually couldn't understand my husbands deeper voice (not so much of a problem for me), but within 6 months the volume control AND the power control for the tv failed.
7/8/2019 update: replacement remote came today. SAME ISSUE: would NOT work either volume or power tv on/off. Now techie tells me ""its not compatible with my tv"" EVEN THO THE LAST ONE WORK THE VOLUME & POWER FOR 6 WEEKS!
Save your money on this and the stick, buy a roku & run your Prime shows thru it.

I asked if they would replace it since it was less than a year old. Got $5 off, still have to pay an additional $25 for another piece of junk.
Then, the second one I have ordered failed in 6 weeks. I contacted customer service. Since there is a 90 day warranty on it, I am getting another one sent to me. This is a real disappointment.
I may just use my roku instead.",1,-0.8762,Negative,208
16,"Do not buy this broken product. I have to resync the remote every hour, so it’s worthless. Hopefully they give refunds and bring back the old remote.

Update:
Got the replacement remote in the mail, synced it, and it stopped working within 5 minutes. What is lower than 1 Star? How many of these do I have to order before I get one that works!?",1,-0.8221,Negative,65
17,Won’t stay paired to older fire tv models. Returning this POS and will be using the phone app for a remote.,1,-0.34,Negative,21
18,"I sent this remote back it only worked have the time . Apple TV works 10 times better than fire stick or this remote. The 4 th gen Apple TV just works along with the volume and power button on the Apple remote.
You jusr have a fork over more cash for Apple but if you have an
iPhone best thing ever.",1,0.7935,Positive,62
