,reviews,stars,Compound Score,Sentiment,word_count
172,"I have a 2016 Vizio smart TV and like a 2008 LG audio receiver. I thought for sure I was going to run into issues getting this remote to power on/off both devices and manage the volume of the receiver, but I was wrong! Whole setup process took me probably 10 minutes. The on-screen prompts were clear and easy to follow, and . . . wow! It just works! No more juggling 3 remotes to navigate my tv watching (I'm on the Fire Stick almost 100% of the time - I have a OTA antenna but rarely use it). I couldn't be happier!",5,0.6315,Positive,103
173,"Obviously it's great have volume and power controls for the Fire TV. This is how it should have came to begin with. Only reason it's not 5 stars is the build quality. The back cover for the batteries doesn't fit super cleanly so there's a little lip that can scratch your hand, not terrible just annoying. Also the cover slides off too easily.",4,0.7818,Positive,63
174,I bought two of these new remotes. I really like that they have a power button and volume control. It allows me to get rid of the TV and Receiver remotes. It is backwards compatible. I used one on a 4K Fire TV (third generation dong) and another new remote on a 2nd Generation Fire Stick. Setup was very easy. I just used the old remote to navigate to the settings and then added a new remote. The new remote then asked me if I wanted to add TV control. It automatically figured out what TV I had. Easy as it comes!,5,0.6573,Positive,102
175,"I bought the remote cause my dig chewed up the one that came with the fire stick but the remote cost almost as much as a new fire stick would cost.

It would good mostly but I never use the voice control. The power will sometimes turn on the soundboard but not the tv, and then if you hit power again it turns on the tv but turns the power bar off.

All in all the fire stick is great for the price, but the remote in its own should be cheaper. I would have bought a new fire stick but the remote can only be paired to one fire stick at a time so you would have to go into settings every time you switch.",2,-0.3818,Negative,126
176,"I freaking LOVE my firestick! I wish I wouldve switched forever ago. I no longer pay for cable and I can watch things on the apps. Yes, so apps require you to pay for a service but there are ways to not have to. On to the 1 complaint I have. I have 2 sticks in the house for upstairs and downstairs. I also have 2 children. Coincidentally, both remotes went missing. Amazon only allows 1 replacement remote to be bought per account. Please!!! Allow me to buy a second one. If you're worried about ""difficulty of syncing"" the new remote to your stick, I have one word for ya. Dont! It's extremely easy. The instructions in the box had me up and running in less than 5 min.",4,-0.7676,Negative,129
177,The remote was a perfect replacement. The original remote that came with the fire stick stopped working so when this one came on sale I knew i needed it. The only probable that I have is sometimes it loses connection the fire stick so to solve it you just have to press the home button for 10 seconds to reconnect it. It's a little hassle but it hasn't happened for several days now so the problem might have fixed itself by now.,4,-0.6031,Negative,82
178,"Was so happy to see Amazon finally added this functionality. I Initially could not keep it paired with my Fire TV and was very frustrated. Then I Actually read the requirements and realized it would not work with my previous generation device. Fortunately, I have another newer device and all worked well when I switched to that. Fairly easy setup to control my Vizio TV and Samsung soundbar. Finally only need one remote.

I suspect many of the complaints are due to older generation Fire devices which will not pair correctly.",5,-0.4019,Negative,91
179,"I like the idea but the remote won’t pair with my Echo, only Fire TV which plays through my Echo. I can’t control the volume when connected to Fire TV on the actual TV or the Echo so the feature is useless to me :( not sure if it is only compatible with the newest model but mine we’re purchased in recent months.",2,-0.9176,Negative,63
180,"I have purchased 9 amazon fire stick remotes in the last 2 years. Each remote only lasts 2 to 3 months and then they just stop working. And no, it's not the batteries. Each time I order a new one, I hope that it has been improved. They never are. I have spent a fortune in these horribly manufactured remotes. How about reimbursing me for all the money I have spent in the last 2 years!!! Your remotes suck!",1,-0.6562,Negative,79
181,"This remote is great for other devices too, like the Nvidia Shield. I think it is better than the standard remote on most devices because it has physical buttons instead of useless touch gestures! Glad I got this as my new remote for my Shield. The only problem is that the voice button does not work with Google Assistant out of the box, but I have read that it is possible to get it working after some tinkering.",5,0.5848,Positive,78
182,"Great item; performs macro functions and is very easy to program. With the touch of a button it turns on my tv, receiver, and seamlessly operates the fire stick while maintaining volume control of the receiver. Lots of flexibility in a small package and operates the same as a traditional fire stick remote.. was contemplating buying and programming a universal remote but this made that unnecessary",5,0.4491,Positive,66
183,I’ve gone through 5 of these remotes. They either stop working or they drain batteries within a day or two. The price of the remote alone is almost as much as buying a whole new fire stick with a remote. Most recently I started using the remote app but 75% of the time it either will not connect or is too slow/glitchy to function properly. Getting rid of my firestick and buying a different streaming device.,1,-0.4215,Negative,76
184,wife lost the first one so I ordered this replacement that set up and works fine. they ask about the voice command stuff but we never use it . At least I don't use the voice recom system alexa does not understand half I say and I like to think I am clear spoken. I don't watch tv enough to sit there repeatly asking some remote to change channels when I got the damn thing in my hand.,5,0.7992,Positive,78
185,"I don't leave reviews often. But I was devastated when I lost my Firestick remote! I read the reviews and was terrified to order it because people said it's cheaply made, that they couldn't pair it, the batteries didn't fit, it was so hard to pair, etc., And I thought, well it's $30 and a whole new Firestick is only $50 what should I so. I took a chance. It's NOT cheaply made, it's exactly like the the remote that came with my Firestick, the batteries fit, if you read what it works with, THAT IS what it works with, and it's easy to pair and I'm technologically challenged! It doesn't come with instructions, but youtube it and you're good. Fear not and if you need it buy it!",5,-0.8056,Negative,129
186,This is the same remote as I used to have but my toddler spilled juice on and fried the old one. I would’ve given this 5 starts because it is a wonderful product it’s just the price that’s outrageous. A whole new Firestick is only $10 more than just buying the remote.,3,0.2617,Positive,52
187,"The remote that came with the Fire Cube was destroyed by batteries that leaked in the remote and damaged it irreparably. I was forced to buy this remote and so glad I did. It has some key features not available on the original remote. This new remote has a power button, volume up and down, and mute buttons; all missing from the missing remote. I recommend this remote to replace the OEM remote even if it wasn't destroyed by bad batteries.",5,-0.4688,Negative,81
188,"Pair Firestick Remote Guide
1. To turn on your Fire TV/Stick, unplug and plug back in your device.

2. From the home screen, press and hold down the Home Button on your remote for up to 20 seconds.

3. A message will prompt in the bottom right corner of the screen acknowledging the pairing is complete.",5,-0.34,Negative,56
189,"When I ""cut the cable""... I added the Amazon Recast for local HD channels (live in Los Angeles and get great antenna reception) and 3 Fire Sticks. One 4K and 2 2nd Generation Fire Sticks.
I really like the 2nd Generation remotes since they control everything and are so easy to set up.
Highly recommended.

I",5,0.819,Positive,56
190,"Important to research details on your smart tv, alexa, amazon, streaming programs and read options to add or replace.

Once you find out how to install and add apps, this is a great buy.

Read blogs before calling tech support. Reason: it's best to know some of the answers you will be asked by technician.",5,0.9451,Positive,55
191,"We loved this - much better than the original remote that came with Fire Stick. But, we've tried replacing batteries, moving them around, and the darn thing just won't work MOST of the time. It will erratically work sometimes, but if you are putting in a pin, it will only get 2-3 numbers out of the 5. ANNOYING and we don't have much of an option but to buy another one.",2,-0.3181,Negative,71
192,"I'm not sure if this is a common problem but I recently got an Amazon firestick. It was awesome but then two to three weeks later the remote stopped working. The on/off button and the volume button still worked but the home button and the actual up/down control stopped working. i thought maybe i dropped it or something so i didn't initially report the problem so i bought a new remote. I received the new remote synced it to the firestick and the same problem occurred. everything was fine for two to three weeks and then out of no where only the volume controls functioned. I tried putting new batteries in it, i tried re-syncing it, i tried looking up solutions online but i can't figure out how to fix it. any tips would be greatly appreciated.",1,0.2284,Positive,137
193,Bought this as a replacement because my German Shepherd likes to chew. Connected just fine. A little pricey for a replacement in my opinion. I could have paid $20 more dollars and got a new firestick and remote.,5,0.5574,Positive,38
194,"It's really nice having the volume and power buttons on the FireTV remote now. But in the process of adding those buttons, they changed the distance between the other buttons and now the old covers won't fit. It's also a lot easier for folks with fat fingers to hit more than one button at a time. The old remotes were fantastic, they just needed some more buttons. They DIDN'T need to be moved around. SMH.

Someone should have reminded the designers - if it ain't broke, don't fix it. Too late now.",3,0.7864,Positive,92
195,"This remote is awesome. Its such a huge upgrade to the previous version for the following reasons:
1. Power button! Combined with my Fire TV its amazing as i press the button and the TV/soundbar both turn on
2. Volume Buttons! No need to keep two remotes around as i primarily watch netflix,hbo,prime on the fire tv.",5,0.6988,Positive,57
196,"Previously we have spent over $200 on our 4 sets of Fire Sticks to get cheap junk attachment remotes for volume and power on the TV. This seems well built, ridiculously easy to program, and simply works. Thank you Amazon for finally including this in your remotes! We tried one for a month, then just got our second one. Using Sanyo and Vizio TV's and not one issue so far, will be getting a couple more as well.",5,0.8058,Positive,78
197,Was forced to upgrade my Fire Stick because my TV app was not compatible with my working 1st Gen stick. All-in-all the new remote is an improvement. I like the volumes controls and love the TV power button. Now I no longer need two remotes to watch. I refuse to use Alexa so don't have an opinion on voice recognition.,5,0.2263,Positive,60
198,"We purchased this in December as a replacement for our Fire TV we had bought through Amazon on November. We didn’t know it is NOT compatible with a Fire TV that is made by Insignia until I had to do research to get a number to find out why it wasn’t working.
Boo! It should say what Fire TV it is compatible with.",1,-0.6696,Negative,63
199,"I was hesitate to purchase this remote as it didn't have the best reviews. However, due to my dog eating my previous remote and my lack of desire to purchase a new stick just for the remote I gave it ago. The remote is great! It works just like the original. At first the volume control didn't work...which concerned me. But, once I reset the firestick a second time it started working perfectly. I would recommend this remote if you are in need of just a remote!!",5,0.9238,Positive,87
200,"No matter what I do, I cannot open the back of this remote to put the batteries in. There is no explanation, just a few little pictures. The case just slips in my hand and does not want to separate the back part of the case. Don 't waste your money on this crap.",1,-0.6244,Negative,54
201,"Ordered Saturday, arrived Sunday. Took approximately 2 mins to set up.

My 2.5 year old stole my remote control, and we can’t find it anywhere. I downloaded the fire stick app for my iPhone, which works, but not well. Used the fire stick app to go to setting, add a remote, and boom. New remote set up. Just like that. Thanks amazon for the easy install, just wish the remote wasn’t $30 dollars!!",5,0.9024,Positive,73
202,"Nice remote and very strong IR transmitter. Better range than factory remotes of TV and home theater system.

The software on the fire stick that makes it work with all of your devices is nice. Almost works for everything we have, but close enough. If I didn't have some weird items in our TV setup it would turn everything on and off. It controls the volume on our home theater system so it's almost one power button for everything and one volume button for everything. Again we have a few wierd items, like an Xbox 360 being used as a media center extender, that I have to turn off sperately, but that's an old setup so I don't fault that against this product. Would recommend.",4,0.9423,Positive,125
203,"great improvement. the extra volume, and mute buttons are perfect. now you can turn your tv on/off. the battery compartment is easy to slide on/off. there is no arrow to help you but, hold your thumb on the face of the remote. with your pointer finger and middle finger holding the back, push up with your thumb. and voila, easy peasy. your welcome.",5,0.9428,Positive,63
204,"I’ve purchased 2 of these to replace Fire TV remotes so I could control better volume, etc. WIth both purchases, the units were delivered with batteries, but the batteries were dead on arrival. With the 1st unit, I thought I was not following directions correctly when trying to pair. After a bit of puzzling, I replaced the batteries, and everything worked fine. When the 2nd purchase responded in the same way as the 1st (no light), I immediately replaced the batteries and was able to pair the remote. An annoying nuisance and an unnecessary expense for me (although minor.)",4,-0.8422,Negative,99
205,"overall i think fire tv is great. i have an amazon fire tv plus two amazon fire tv sticks. i use the sticks when travelling, but have already lost the controller to both. so, i bought two replacement remotes. i tried pairing the first one with a tv stick 10 times, following all the instructions plus workarounds, and never got it to pair. switched and tried it against the second fire stick and got it to pair on the second try.

the second remote has been completely unsuccessful. i have tried pairing it with both sticks plus the full fire tv at least 6-8 times each, and hasn't been successful once. so, i'm returning it.

so overall, great when they work but getting them to pair can be quite difficult (or impossible).",2,-0.9249,Negative,132
206,I really like this one has volume control now I don’t have to chase the other remote all over the room. The price is a little steep for adding just one feature. Get one around the holidays when they are discounted. Addition of the volume control is seamless you just parrot like any other controller and the volume control is there.,5,0.796,Positive,61
207,"I use different streaming devices (Nvidia Shields, Fire Sticks and other Android devices)
This is probably my favorite universal remote to use with all of them. Can control Streaming Device, TV and Bose Soundbar as well. After pairing I love how everything I've programmed to Turns on by hit 1 button on the remote. May purchase another 1 or 2 for other devices I have",4,0.7845,Positive,65
208,"Got this like gem today and it was easy to set up and works well so far with the TV BUT the battery door on it is a royal pain. Very very hard to open and no arrow as well on mine. Obviously I could figure out what direction it opens in, but by hand could not do it. Finally got a rubber jar opener thing and that gave it enough grip to open the battery door. Phew.",4,0.1263,Positive,78
209,"Whenever I get out of one app and switch to another app and watch another program (video), the sound does not come on. I have to get out of the new program and go into another that has sound. Then I have to jump back to the video I want to watch so I can have some sound. This problem occur most the time when I am switching from one app to a new app. Is it the Fire Stick or the streaming?",3,-0.6399,Negative,83
210,It was very straight forward to get it synced. I left the batteries out. I unplugged the Fire-stick and plugged back in. I went to the home screen. I put the batteries in the remote and pressed the home button for like 10 seconds and the light on top of the remote flickered amber and was then paired.,5,0.6697,Positive,58
211,This remote will not power on my TV with either IR or or CEC control. Tried various IR settings with no luck. Called support. The representative was unknowable and completely useless. I asked for 2nd level support or to speak with a supervisor and was told that I could not be transferred.,1,-0.0446,Neutral,52
212,"Love the remote, hate the battery cover - only a month of normal usage cover becomes loose and easily slips off. I thought that I got the bad remote and asked for a replacement. But replacement got the same problem even quicker. Battery cover just falls off if I don’t hold it tightly. Bad quality",2,-0.882,Negative,55
213,Works well and really easy set up. I was a little hesitant as other reviews indicated some people were having a hard time setting up the remote. We followed the simple set up instructions and had it up on running without any issues in less than 5 minutes. My husband is thrilled that he doesn't have to have a separate remote to turn on the TV or control the volume!,5,0.749,Positive,70
214,This remote is so small and easy to lose. They should make it to where you can ask echo to find your remote and then it beeps or something. I like this remote better than all the other generations because it has the volume button and power button. I’m super glad I got it on sale because Otherwise it feels a little pricey. Would buy again if on sale as a spare.,5,0.9147,Positive,72
215,TV in my BR is older .. but still works fine.. However the OLD remote with the tv was a pain in the as* to get the TV to turn on .. NOT anymore.. This litle gem DOES IT ALL.. on and off TV control .. voice is MUCH better on the older TV .. LOVE these ......so much easier than having 2 remotes..,5,0.9217,Positive,64
216,"This remote worked perfectly at first with my Samsung TV. But I think a recent update of firmware by Amazon has caused interference with anynet+ on my TV. Now, if I try to use voice remote control it causes anynet to shut down & my screen goes blank. Therefore I cannot use voice control now. TV works fine with older Fire remotes using voice.",3,0.4118,Positive,64
217,"Works perfectly! I was afraid there would be issues connecting it to my firestick since this was a replacement remote, but there was nothing to it.",5,0.4389,Positive,26
218,"As of now, the headphone jack doesn’t work with headphones. I am unable to sync it to redo it either because one remote HAS to be synced at all times 🙄 haven’t had time to play musical remotes.
So the reason I bought the item, I haven’t even used because it doesn’t work.
I also have no idea which app you’re supposed to download to “find the remote”.",5,0.0516,Positive,68
219,Our older Amazon Fire TV Remote just stopped working suddenly so we ordered the newer one with mute button and volume control. It is working great with our second generation Fire TV (the diamond shaped one) and the mute and volume controls mean that we no longer have to use two remotes when we watch TV!,5,0.1511,Positive,56
220,"Not much to say except that it does its job as being an OEM (Original Equipment Manufacturer) device By Amazon For Amazon (BAFA).
Every requirement/expectation is met (Pairing, voice control, volume buttons etc).
Can't stress enough that you cannot go wrong with an item made by a company for a company product haha",5,0.8906,Positive,53
221,"Super simple to set up. Product synced instantly, then downloaded new firmware to remote ( 60 secs) and control volume, ON/OFF, and most importantly...Mute. I bought this as second remote for our main Fire TV 4K. We stream Youtube TV, Amazon Prime, Hulu and Netflix. Being able to mute through the commercials is the best quality of this remote. Now I sit on my couch, and mute all those load commercials. I hope future models will add a Timer function it would make this perfect.",5,0.94,Positive,85
222,"Followed ""Programming"" instructions, but this remote would not pair with FireTVstick. Tried it with Amazon batteries it came with and also new Duracell's, no success. Worthless...waste of money.",1,-0.4492,Negative,28
223,"Works and paired easy. Once it started it asked to pair my tv. Worked great. If you want to pair another piece of equipment you’ll have to go into settings/equipment control/manage equipment
Then find your device name.
They really should add this in instructions",5,0.8074,Positive,44
224,"I've joined Sling, Hulu and ESPN. To see the final games I'd need to join (pay for) ESPN+. In addition to that frustration, it's difficult to maneuver around screen and find shows/programs you want to see.

I'd give it 5 stars if there was a TV Guide of all apps and channels.",3,-0.5423,Negative,52
225,"This remote SUCKS!!! Tech support is awful. It paired to my tv, then unpaired to it. Then it wouldnt pair at all. Tech support wanted me to download some stupid app that wouldn't open. DO NOT GET SUCKED INTO THIS SCAM!!! Now they want me to buy new remote, only had this one 3 weeks!!! I will never buy a fire tv again",1,-0.7562,Negative,63
226,"Setup was easy, after two weeks it just stopped working. Fortunately, I had downloaded the Fire app on my phone. Today (4/20), although the window for replacement is still open, the option is not available in the listings of my recent Amazon purchases. I am not a happy camper, although in fairness, the Fire Stick is superior to the Roku device which it replaced.",1,-0.1526,Negative,64
227,"HEADLINE SAY'S IT ALL, IT'S SO NICE TO BE DEALING WITH JUST ONE REMOTE. BEFORE PURCHASING THIS REMOTE I HAD A REMOTE FOR THE TV, ONE FOR VOLUME, AND ONE FOR MY FIRE TV. NOW IT'S JUST ONE AND I LOVE IT, THINKING ABOUT GETTING ANOTHER ONE SO I DON'T HAVE TO WAKE MY HUSBAND TO BE ABLE TO GET THE REMOTE HE HAS FALLEN ASLEEP WITH. U CAN'T GO WRONG WITH THIS.",5,0.7558,Positive,73
228,This is the remote Nvidia should sell with the Shield. Every button works and the mic works. Real volume up and down & mute. Feels good in your hand - not way too big like a cable remote and not just too small like the Shield remote (also an issue imo). Some people dislike AAA batteries but I much prefer them over watch batteries.,5,0.5789,Positive,64
229,"I inquired here whether this remote would pair with an older Samsung DLP tv. I was told that it wouldn't. But on the off chance that internet advice might not be accurate, I ordered the remote anyway, and it paired flawlessly with my DLP set. So I can easily control the necessary tv functions and Fire Stick using a single remote - on/off/volume/mute all work fine.",5,0.7427,Positive,66
230,"I was very skeptical of purchasing this but for the price, I couldn't pass it up. It came literally the next day and all the functions are accessible. The registering of the device was quick as turning on the tv and holding the home button for at least 5 sec. then going to the options section and registering as new Bluetooth device. I highly recommend this device to help out with losing any television remote that you can no longer operate the volume to.",5,0.0626,Positive,84
231,"Because my kids are animals, I never give them original remotes (which usually costs a lot to replace). I have tried 2 different 2.4GHz USB Android OS remotes (for approx $12), but were horrible.

This Amazon remote is Bluetooth, all buttons work exactly as expected, and is just as responsive as the original remote. And best yet, I caught it on sale for only $15. Perfect!",5,0.9374,Positive,66
232,"Maybe its' my Fire TV ""box"". Maybe its the 3 controllers I've bought that wont sync. Maybe the whole Fire TV system needs to be troubleshot. It was working for a while (kinda - with constant rebooting). This form of TV watching has become a second job...non-paying. I want my money back, guess I should read more, thanks Jeff! No problems with my ROKU. Yes the Interface is not as nice but at least it works!! Anyone else dealing with this?",1,0.3954,Positive,81
